[
    {
        "user_input": "que ayudas hay en murcia?",
        "reference": "",
        "response": "No tengo resultados.",
        "retrieved_contexts": [
            " detalle de la convocatoria de ayuda o subvención: 804558 enlace a convocatoria: https://www.pap.hacienda.gob.es/bdnstrans/ge/es/convocatorias/804558 órgano, comunidad, autonomía, provincia o ayuntamiento convocante: mancomunidad intermunicipal barrio del cristo aldaia-quart de poblet - mancomunidad intermunicipal barrio del cristo aldaia-quart de poblet fecha de recepción: 2024-12-20t09:18:10+01:00 tipo de ayuda: subvención y entrega dineraria sin contraprestación tipo de convocatoria: concesión directa - canónica presupuesto total: 4000 euros descripción: convocatoria concesión subvención ayudas carnets profesionales tipos de beneficiarios: personas físicas que no desarrollan actividad económica sectores involucrados: educación región de impacto: es523 - valencia / valència finalidad: fomento del empleo bases reguladoras: convocatoria concesión subvención ayudas carnets profesionales publicación en diario oficial: sí estado de convocatoria abierta: no inicio de convocatoria: al día siguiente de su publicación en el bop fin de convocatoria: \n detalle de la convocatoria de ayuda o subvención: 804841 enlace a convocatoria: https://www.pap.hacienda.gob.es/bdnstrans/ge/es/convocatorias/804841 órgano, comunidad, autonomía, provincia o ayuntamiento convocante: sevilla - ayuntamiento de sevilla fecha de recepción: 2024-12-20t13:49:39+01:00 tipo de ayuda: otros instrumentos de ayuda tipo de convocatoria: concurrencia competitiva - canónica presupuesto total: 4000 euros descripción: xv premio de poesía hermanos machado, aprobado por resolución de la vicepresidencia del instituto de cultura y artes de sevilla (icas) de fecha 19 de diciembre de 2024, del servicio de gestión administrativa y subvenciones. tipos de beneficiarios: personas físicas que no desarrollan actividad económica sectores involucrados: actividades artísticas, recreativas y de entretenimiento región de impacto: es618 - sevilla finalidad: cultura bases reguladoras: extracto de la resolución del 19 de diciembre de 2024 de la vicepresidencia del instituto de la cultura y las artes de sevilla (icas), por el que se aprueban las bases y la convocatoria del xv premio iberoamericano de poesía hermanos machado 2025. publicación en diario oficial: sí estado de convocatoria abierta: no inicio de convocatoria: a partir de su publicación en el boletín oficial de la provincia de sevilla fin de convocatoria: \n detalle de la convocatoria de ayuda o subvención: 803311 enlace a convocatoria: https://www.pap.hacienda.gob.es/bdnstrans/ge/es/convocatorias/803311 órgano, comunidad, autonomía, provincia o ayuntamiento convocante: hoyo de manzanares - ayuntamiento de hoyo de manzanares fecha de recepción: 2024-12-16t20:12:32+01:00 tipo de ayuda: subvención y entrega dineraria sin contraprestación tipo de convocatoria: concurrencia competitiva - canónica presupuesto total: 2000 euros descripción: bases y convocatoria de 10 de diciembre de 2024, de ayudas a deportistas individuales de hoyo de manzanares (temporada 2023-2024) tipos de beneficiarios: pyme y personas físicas que desarrollan actividad económica sectores involucrados: actividades artísticas, recreativas y de entretenimiento región de impacto: es300 - madrid finalidad: otras prestaciones económicas bases reguladoras: bases y convocatoria de 10 de diciembre de 2024, de ayudas a deportistas individuales de hoyo de manzanares (temporada 2023-2024) publicación en diario oficial: sí estado de convocatoria abierta: no inicio de convocatoria: 15 días hábiles de su publicación en el boletín oficial de la comunidad de madrid (bocm) fin de convocatoria: finalizado el plazo de 15 días hábiles \n detalle de la convocatoria de ayuda o subvención: 803444 enlace a convocatoria: https://www.pap.hacienda.gob.es/bdnstrans/ge/es/convocatorias/803444 órgano, comunidad, autonomía, provincia o ayuntamiento convocante: pobla de vallbona, la - ayuntamiento de pobla de vallbona, la fecha de recepción: 2024-12-17t10:49:50+01:00 tipo de ayuda: subvención y entrega dineraria sin contraprestación tipo de convocatoria: concurrencia competitiva - canónica presupuesto total: 5000 euros descripción: aprobación de la convocatoria de las subvenciones para deportistas de la pobla de vallbona que participen en competiciones deportivas oficiales de carácter nacional e internacional, para financiar los gastos del ejercicio 2024 tipos de beneficiarios: personas físicas que no desarrollan actividad económica sectores involucrados: actividades deportivas región de impacto: es523 - valencia / valència finalidad: otras prestaciones económicas bases reguladoras: convocatoria subvenciones de concurrencia competitiva destinadas a los deportistas del municipio que participen en competiciones deportivas oficiales de l carácter nacional e internacional, para financiar los gastos del 2024 publicación en diario oficial: sí estado de convocatoria abierta: no inicio de convocatoria: del 7 de enero de 2025 fin de convocatoria: al 7 de febrero de 2025 \n detalle de la convocatoria de ayuda o subvención: 804940 enlace a convocatoria: https://www.pap.hacienda.gob.es/bdnstrans/ge/es/convocatorias/804940 órgano, comunidad, autonomía, provincia o ayuntamiento convocante: pontes de garcía rodríguez, as - ayuntamiento de as pontes de garcía rodríguez fecha de recepción: 2024-12-20t18:38:26+01:00 tipo de ayuda: subvención y entrega dineraria sin contraprestación tipo de convocatoria: concurrencia competitiva - canónica presupuesto total: 34630 euros descripción: convocatoria de subvenciones para la organización de eventos deportivo-turísticos para el año 2024 tipos de beneficiarios: personas jurídicas que no desarrollan actividad económica sectores involucrados: actividades artísticas, recreativas y de entretenimiento región de impacto: es111 - a coruña finalidad: otras prestaciones económicas bases reguladoras: bases reguladoras de subvenciones para la organización de eventos deportivo-turísticos para el año 2024 publicación en diario oficial: sí estado de convocatoria abierta: no inicio de convocatoria: al día siguiente de la publicación del extracto de la convocatoria en el bop fin de convocatoria: cinco días naturales a partir de la publicación del extracto en el bop \n"
        ]
    },
    {
        "user_input": "que ayudas tienes para madrid?",
        "reference": "",
        "response": "**Convocatoria de Ayuda: 803627**\n- **Órgano convocante:** Fundación de la Energía de la Comunidad de Madrid\n- **Enlace a la convocatoria:** [Acceder](https://www.pap.hacienda.gob.es/bdnstrans/ge/es/convocatorias/803627)\n- **Presupuesto total:** 3,085,561 Euros\n- **Descripción:** Resolución de la Fundación de la Energía de la Comunidad de Madrid por la que se convocan ayudas para incentivar la sustitución de ventanas, en viviendas del sector residencial, en desarrollo del Plan Renove de ventanas de la Comunidad de Madrid.\n- **Beneficiarios:** Personas físicas que no desarrollan actividad económica.\n- **Sectores involucrados:** Actividades de construcción especializada, fabricación de productos metálicos, excepto maquinaria y equipo.\n- **Región de impacto:** Comunidad de Madrid (ES30).\n- **Estado de convocatoria:** Cerrada.\n- **Fechas importantes:**\n  - Inicio de convocatoria: 13/01/2025\n  - Fin de convocatoria: 31/08/2025\n\n---\n\n**Convocatoria de Ayuda: 804712**\n- **Órgano convocante:** Comunidad de Madrid - Consejería Economía, Hacienda y Empleo\n- **Enlace a la convocatoria:** [Acceder](https://www.pap.hacienda.gob.es/bdnstrans/ge/es/convocatorias/804712)\n- **Presupuesto total:** 2,835,000 Euros\n- **Descripción:** Formación CAP mercancías y permiso C.\n- **Beneficiarios:** Personas jurídicas que no desarrollan actividad económica, PYME y personas físicas que desarrollan actividad económica.\n- **Sectores involucrados:** Transporte de mercancías por carretera y servicios de mudanza.\n- **Región de impacto:** Comunidad de Madrid (ES30).\n- **Estado de convocatoria:** Cerrada.\n- **Fechas importantes:**\n  - Inicio de convocatoria: Desde el día siguiente a la publicación del extracto.\n  - Fin de convocatoria: 15 días desde la publicación del extracto.\n\n---\n\n**Convocatoria de Ayuda: 803878**\n- **Órgano convocante:** Ayuntamiento de Las Rozas de Madrid\n- **Enlace a la convocatoria:** [Acceder](https://www.pap.hacienda.gob.es/bdnstrans/ge/es/convocatorias/803878)\n- **Presupuesto total:** 50,000 Euros\n- **Descripción:** Bases de la convocatoria para el otorgamiento de prestaciones sociales económicas destinadas a la adaptación de la vivienda habitual y productos de apoyo.\n- **Beneficiarios:** Personas físicas que no desarrollan actividad económica.\n- **Sectores involucrados:** Actividades sanitarias y de servicios sociales.\n- **Región de impacto:** Madrid (ES300).\n- **Estado de convocatoria:** Cerrada.\n- **Fechas importantes:**\n  - Inicio de convocatoria: No especificado.\n  - Fin de convocatoria: No especificado.\n\n---\n\n**Convocatoria de Ayuda: 804870**\n- **Órgano convocante:** Madrid - Área de Gobierno de Economía, Innovación y Hacienda\n- **Enlace a la convocatoria:** [Acceder](https://www.pap.hacienda.gob.es/bdnstrans/ge/es/convocatorias/804870)\n- **Presupuesto total:** 30,000 Euros\n- **Descripción:** Decreto de la delegada del Área de Gobierno de Economía, Innovación y Hacienda, por el que se aprueba la convocatoria pública de la primera edición de los premios Consumo Responsable Ciudad de Madrid.\n- **Beneficiarios:** PYME y personas físicas que desarrollan actividad económica.\n- **Sectores involucrados:** Comercio al por mayor y al por menor; reparación de vehículos de motor y motocicletas.\n- **Región de impacto:** Madrid (ES300).\n- **Estado de convocatoria:** Cerrada.\n- **Fechas importantes:**\n  - Inicio de convocatoria: Día siguiente al de la publicación en el BOCM.\n  - Fin de convocatoria: 20 días naturales desde el día siguiente al de la publicación en el BOCM.\n\n---\n\n**Convocatoria de Ayuda: 804447**\n- **Órgano convocante:** Área Metropolitana de Barcelona\n- **Enlace a la convocatoria:** [Acceder](https://www.pap.hacienda.gob.es/bdnstrans/ge/es/convocatorias/804447)\n- **Presupuesto total:** 55,524.86 Euros\n- **Descripción:** Concesión de subvenciones del Área Metropolitana de Barcelona (AMB) a las organizaciones sindicales con representación en el ámbito territorial del área metropolitana de Barcelona.\n- **Beneficiarios:** Personas jurídicas que no desarrollan actividad económica.\n- **Sectores involucrados:** Actividades profesionales, científicas y técnicas.\n- **Región de impacto:** Barcelona (ES511).\n- **Estado de convocatoria:** Cerrada.\n- **Fechas importantes:**\n  - Inicio de convocatoria: A partir del día siguiente de la publicación del extracto de la convocatoria en el BOPB.\n  - Fin de convocatoria: 20 días hábiles desde el inicio.",
        "retrieved_contexts": [
            " detalle de la convocatoria de ayuda o subvención: 803627 enlace a convocatoria: https://www.pap.hacienda.gob.es/bdnstrans/ge/es/convocatorias/803627 órgano, comunidad, autonomía, provincia o ayuntamiento convocante: otros - fundación de la energía de la comunidad de madrid fecha de recepción: 2024-12-17t14:37:42+01:00 tipo de ayuda: subvención y entrega dineraria sin contraprestación tipo de convocatoria: concurrencia competitiva - canónica presupuesto total: 3085561 euros descripción: resolución de la fundación de la energía de la comunidad de madrid por la que se convocan ayudas para incentivar la sustitución de ventanas, en viviendas del sector residencial, en desarrollo del plan renove de ventanas de la comunidad de madrid tipos de beneficiarios: personas físicas que no desarrollan actividad económica sectores involucrados: actividades de construcción especializada, fabricación de productos metálicos, excepto maquinaria y equipo región de impacto: es30 - comunidad de madrid finalidad: industria y energía bases reguladoras: orden 4494/2024 de la consejería de medio ambiente, agricultura e interior, por la que se aprueban las bases reguladoras para la concesión de ayudas por la fundación de la energía de la comunidad de madrid para el desarrollo del plan renove de ventanas publicación en diario oficial: sí estado de convocatoria abierta: no inicio de convocatoria: 13/01/2025 fin de convocatoria: 31/08/2025 \n detalle de la convocatoria de ayuda o subvención: 804712 enlace a convocatoria: https://www.pap.hacienda.gob.es/bdnstrans/ge/es/convocatorias/804712 órgano, comunidad, autonomía, provincia o ayuntamiento convocante: comunidad de madrid - consejería economía, hacienda y empleo fecha de recepción: 2024-12-20t11:45:01+01:00 tipo de ayuda: subvención y entrega dineraria sin contraprestación tipo de convocatoria: concurrencia competitiva - canónica presupuesto total: 2835000 euros descripción: formación cap mercancías y permiso c tipos de beneficiarios: personas jurídicas que no desarrollan actividad económica, pyme y personas físicas que desarrollan actividad económica sectores involucrados: transporte de mercancías por carretera y servicios de mudanza región de impacto: es30 - comunidad de madrid finalidad: fomento del empleo bases reguladoras: formación cap mercancías y permiso c publicación en diario oficial: sí estado de convocatoria abierta: no inicio de convocatoria: desde el día siguiente a la publicación del extracto fin de convocatoria: 15 días desde la publicación del extracto \n detalle de la convocatoria de ayuda o subvención: 803878 enlace a convocatoria: https://www.pap.hacienda.gob.es/bdnstrans/ge/es/convocatorias/803878 órgano, comunidad, autonomía, provincia o ayuntamiento convocante: rozas de madrid, las - ayuntamiento de rozas de madrid, las fecha de recepción: 2024-12-18t13:02:05+01:00 tipo de ayuda: subvención y entrega dineraria sin contraprestación tipo de convocatoria: concurrencia competitiva - canónica presupuesto total: 50000 euros descripción: bases de la convocatoria para el otorgamiento de prestaciones sociales económicas destinadas a la adaptación de la vivienda habitual y productos de apoyo. tipos de beneficiarios: personas físicas que no desarrollan actividad económica sectores involucrados: actividades sanitarias y de servicios sociales región de impacto: es300 - madrid finalidad: servicios sociales y promoción social bases reguladoras: bases y convocatoria para el otorgamiento de prestaciones sociales económicas destinadas a la adaptación de la vivienda habitual y productos de apoyo. publicación en diario oficial: sí estado de convocatoria abierta: no inicio de convocatoria: fin de convocatoria: \n detalle de la convocatoria de ayuda o subvención: 804870 enlace a convocatoria: https://www.pap.hacienda.gob.es/bdnstrans/ge/es/convocatorias/804870 órgano, comunidad, autonomía, provincia o ayuntamiento convocante: madrid - área de gobierno de economía, innovación y hacienda fecha de recepción: 2024-12-20t14:25:51+01:00 tipo de ayuda: subvención y entrega dineraria sin contraprestación tipo de convocatoria: concurrencia competitiva - canónica presupuesto total: 30000 euros descripción: decreto de la delegada del área de gobierno de economía, innovación y hacienda, por el que se aprueba la convocatoria pública de la primera edición de los premios consumo responsable ciudad de madrid tipos de beneficiarios: pyme y personas físicas que desarrollan actividad económica sectores involucrados: comercio al por mayor y al por menor; reparación de vehículos de motor y motocicletas región de impacto: es300 - madrid finalidad: comercio, turismo y pymes bases reguladoras: ordenanza bbrr generales para concesión subvenciones por ayto madrid y op publicación en diario oficial: sí estado de convocatoria abierta: no inicio de convocatoria: dia siguiente al de publicación bocm fin de convocatoria: 20 días naturales desde el dia siguiente al de publicación bocm \n detalle de la convocatoria de ayuda o subvención: 804447 enlace a convocatoria: https://www.pap.hacienda.gob.es/bdnstrans/ge/es/convocatorias/804447 órgano, comunidad, autonomía, provincia o ayuntamiento convocante: area metropolitana de barcelona - àrea metropolitana de barcelona fecha de recepción: 2024-12-19t15:04:42+01:00 tipo de ayuda: subvención y entrega dineraria sin contraprestación tipo de convocatoria: concurrencia competitiva - canónica presupuesto total: 55524.86 euros descripción: concesión de subvenciones del área metropolitana de barcelona (amb) a las organizaciones sindicales con representación en el ámbito territorial del área metropolitana de barcelona. (exp. 900525/24) tipos de beneficiarios: personas jurídicas que no desarrollan actividad económica sectores involucrados: actividades profesionales, científicas y técnicas región de impacto: es511 - barcelona finalidad: fomento del empleo bases reguladoras: bases reguladoras para la concesión de subvenciones del área metropolitana de barcelona a las organizaciones sindicales con representación en el ámbito territorial de la amb. exp. 902389/2021 publicación en diario oficial: sí estado de convocatoria abierta: no inicio de convocatoria: a partir del día siguiente de la publicación del extracto de la convocatoria en el bopb fin de convocatoria: 20 dies hàbiles desde el inicio \n"
        ]
    }
]