[
    {
        "user_input": "ayudas en DIRULAGUNTZA",
        "reference": "",
        "response": "**Convocatoria de Ayuda: 803613**\n- **Órgano convocante:** ILLES BALEARS - FONDO DE GARANTÍA AGRARIA Y PESQUERA DE LAS ISLAS BALEARES (FOGAIBA)\n- **Enlace a la convocatoria:** [Acceder](https://www.pap.hacienda.gob.es/bdnstrans/GE/es/convocatorias/803613)\n- **Presupuesto total:** 140000 Euros\n- **Descripción:** Ayudas de minimis para el fomento de la recría del ganado bovino lechero, inscrito en los libros genealógicos, a las explotaciones de las Illes Balears para el año 2024.\n- **Beneficiarios:** PYME Y PERSONAS FÍSICAS QUE DESARROLLAN ACTIVIDAD ECONÓMICA\n- **Sectores involucrados:** Agricultura, ganadería, caza y servicios relacionados con las mismas\n- **Región de impacto:** ES53 - ILLES BALEARS\n- **Estado de convocatoria:** Cerrada.\n- **Fechas importantes:**\n  - Fecha de recepción: 2024-12-17\n  - **Publicación en diario oficial:** Sí\n\n**Convocatoria de Ayuda: 803866**\n- **Órgano convocante:** REGIÓN DE MURCIA - INSTITUTO DE INDUSTRIAS CULTURALES Y DE LAS ARTES DE LA REGIÓN DE MURCIA ( ICA )\n- **Enlace a la convocatoria:** [Acceder](https://www.pap.hacienda.gob.es/bdnstrans/GE/es/convocatorias/803866)\n- **Presupuesto total:** 150000 Euros\n- **Descripción:** RESOLUCIÓN DEL DIRECTOR GENERAL DEL INSTITUTO DE LAS INDUSTRIAS CULTURALES Y LAS ARTES DE LA REGIÓN DE MURCIA QUE CONVOCA AYUDAS EN RÉGIMEN DE CONCURRENCIA NO COMPETITIVA PARA GIRAS DE MÚSICA EN VIVO DE ÁMBITO NACIONAL E INTERNACIONAL\n- **Beneficiarios:** PYME Y PERSONAS FÍSICAS QUE DESARROLLAN ACTIVIDAD ECONÓMICA\n- **Sectores involucrados:** ACTIVIDADES ARTÍSTICAS, RECREATIVAS Y DE ENTRETENIMIENTO\n- **Región de impacto:** ES62 - REGION DE MURCIA\n- **Estado de convocatoria:** Cerrada.\n- **Fechas importantes:**\n  - Fecha de recepción: 2024-12-18\n  - **Publicación en diario oficial:** Sí\n\n**Convocatoria de Ayuda: 803871**\n- **Órgano convocante:** REGIÓN DE MURCIA - INSTITUTO DE INDUSTRIAS CULTURALES Y DE LAS ARTES DE LA REGIÓN DE MURCIA ( ICA )\n- **Enlace a la convocatoria:** [Acceder](https://www.pap.hacienda.gob.es/bdnstrans/GE/es/convocatorias/803871)\n- **Presupuesto total:** 110000 Euros\n- **Descripción:** RESOLUCIÓN DE LA DIRECCIÓN GENERAL DEL INSTITUTO DE LAS INDUSTRIAS CULTURALES Y LAS ARTES POR LA QUE SE CONVOCA LA CONCESIÓN DE SUBVENCIONES, EN RÉGIMEN DE CONCURRENCIA COMPETITIVA, DE PLAN ESCENA NACIONAL E INTERNACIONAL, EN SU EDICIÓN 2025\n- **Beneficiarios:** PYME Y PERSONAS FÍSICAS QUE DESARROLLAN ACTIVIDAD ECONÓMICA\n- **Sectores involucrados:** ACTIVIDADES ARTÍSTICAS, RECREATIVAS Y DE ENTRETENIMIENTO\n- **Región de impacto:** ES62 - REGION DE MURCIA\n- **Estado de convocatoria:** Cerrada.\n- **Fechas importantes:**\n  - Fecha de recepción: 2024-12-18\n  - **Publicación en diario oficial:** Sí\n\n**Convocatoria de Ayuda: 803757**\n- **Órgano convocante:** CATALUÑA - DEPARTAMENT D'EDUCACIÓ I FORMACIÓ PROFESSIONAL\n- **Enlace a la convocatoria:** [Acceder](https://www.pap.hacienda.gob.es/bdnstrans/GE/es/convocatorias/803757)\n- **Presupuesto total:** 15000000 Euros\n- **Descripción:** Subvenciones destinadas a la escolarización de niños de cero a tres años en las guarderías infantiles de titularidad privada, para el curso 2024-2025\n- **Beneficiarios:** PERSONAS JURÍDICAS QUE NO DESARROLLAN ACTIVIDAD ECONÓMICA\n- **Sectores involucrados:** Educación preprimaria\n- **Región de impacto:** ES51 - CATALUÑA\n- **Estado de convocatoria:** Cerrada.\n- **Fechas importantes:**\n  - Fecha de recepción: 2024-12-18\n  - **Publicación en diario oficial:** Sí",
        "retrieved_contexts": [
            "Detalle de la convocatoria\nInformación de la convocatoria\nÓrgano convocante\nGERNIKA-LUMO AYUNTAMIENTO DE GERNIKA-LUMOSede electrónica para la presentación de solicitudes\nTítulo de la convocatoria en español\nTítulo de la convocatoria en otra lengua cooficial\nGORABIDE ELKARTEARI 2024KO DIRULAGUNTZA\nTipo de beneficiario elegible Sector económico del beneficiario Región de impacto Finalidad (política de gasto)\nServicios Sociales y Promoción Social ES213 - Bizkaia PERSONAS JURÍDICAS QUE NO DESARROLLAN\nACTIVIDAD ECONÓMICAAsistencia en establecimientos residenciales para\npersonas con discapacidad intelectual, enfermedad\nmental y drogodependenciaSUBVENCION 2024 ASOCIACION GORABIDE\nTítulo de las bases reguladoras\nSUBVENCION 2024 ASOCIACION GORABIDEDirección electrónica de las bases reguladoras\nhttps://www.bizkaia.eus/lehendakaritza/Bao_bob/2012/12/2\n0121219a242.pdf?hash=0182fbb1795636249a60124af57a27 45#page=12SUBVENCIÓN Y ENTREGA DINERARIA SIN CONTRAPRESTACIÓNInstrumento de ayuda\nConcesión directa - instrumentalTipo de convocatoria\n22.000,00 €Presupuesto total de la convocatoria804947Código BDNS\nNOMecanismo de Recuperación y Resiliencia\n20/12/2024Fecha de registro\n1Página de321/12/2024Detalle de la convocatoria\nInformación sobre la solicitud\n¿El extracto de la convocatoria se publica en diario oficial?\nNo¿Se puede solicitar indefinidamente?\nNo\nFecha de inicio del periodo de solicitud\n01/01/2024Fecha de finalización del periodo de solicitud\n31/12/2024\nInformación específica sobre Ayudas de Estado y de minimis\nSA Number (Referencia de Ayuda de Estado) SA Number (Enlace UE) ¿Cofinanciado con fondos UE?\nNo\nReglamento (UE) Objetivos Sector de productos\n2Página de321/12/2024Detalle de la convocatoria\nInformación del extracto de la convocatoria\n3Página de321/12/2024\n\nDetalle de la convocatoria de ayuda o  subvención: 803613\nEnlace a convocatoria: https://www.pap.hacienda.gob.es/bdnstrans/GE/es/convocatorias/803613\nÓrgano, comunidad, autonomía, provincia o ayuntamiento convocante: ILLES BALEARS - FONDO DE GARANTÍA AGRARIA Y PESQUERA DE LAS ISLAS BALEARES (FOGAIBA)\nFecha de recepción: 2024-12-17T14:11:40+01:00\nTipo de ayuda: SUBVENCIÓN Y ENTREGA DINERARIA SIN CONTRAPRESTACIÓN \nTipo de convocatoria: Concurrencia competitiva - canónica\nPresupuesto total: 140000 Euros\nDescripción: Ayudas de minimis para el fomento de la recría del ganado bovino lechero, inscrito en los libros genealógicos, a las explotaciones de las Illes Balears para el año 2024.\nTipos de beneficiarios: PYME Y PERSONAS FÍSICAS QUE DESARROLLAN ACTIVIDAD ECONÓMICA\nSectores involucrados: Agricultura, ganadería, caza y servicios relacionados con las mismas\nRegión de impacto: ES53 - ILLES BALEARS\nFinalidad: Agricultura, Pesca y Alimentación\nBases reguladoras: Orden de la Consejera de Agricultura y Pesca, de 10 de marzo de 2005, por la que se establecen las bases reguladoras de las subvenciones a los sectores agrario y pesquero.\nPublicación en diario oficial: Sí\nEstado de convocatoria abierta: No\nInicio de convocatoria: \nFin de convocatoria: \n\n\nDetalle de la convocatoria de ayuda o  subvención: 803866\nEnlace a convocatoria: https://www.pap.hacienda.gob.es/bdnstrans/GE/es/convocatorias/803866\nÓrgano, comunidad, autonomía, provincia o ayuntamiento convocante: REGIÓN DE MURCIA - INSTITUTO DE INDUSTRIAS CULTURALES Y DE LAS ARTES DE LA REGIÓN DE MURCIA ( ICA )\nFecha de recepción: 2024-12-18T12:45:38+01:00\nTipo de ayuda: SUBVENCIÓN Y ENTREGA DINERARIA SIN CONTRAPRESTACIÓN \nTipo de convocatoria: Concurrencia competitiva - canónica\nPresupuesto total: 150000 Euros\nDescripción: RESOLUCIÓN DEL DIRECTOR GENERAL DEL INSTITUTO DE LAS INDUSTRIAS CULTURALES Y LAS ARTES DE LA REGIÓN DE MURCIA QUE CONVOCA AYUDAS EN RÉGIMEN DE CONCURRENCIA NO COMPETITIVA PARA GIRAS DE MÚSICA EN VIVO DE ÁMBITO NACIONAL E INTERNACIONAL\nTipos de beneficiarios: PYME Y PERSONAS FÍSICAS QUE DESARROLLAN ACTIVIDAD ECONÓMICA\nSectores involucrados: ACTIVIDADES ARTÍSTICAS, RECREATIVAS Y DE ENTRETENIMIENTO\nRegión de impacto: ES62 - REGION DE MURCIA\nFinalidad: Cultura\nBases reguladoras: Orden de 27 de mayo de 2016 de la Consejería de Cultura y Portavocía (BORM nº 126, de 1 de junio), Modificada por Orden de 7 de octubre de 2019, de la Consejera de Educación y Cultura (BORM nº 247, de 25 de octubre de 2019)\nPublicación en diario oficial: Sí\nEstado de convocatoria abierta: No\nInicio de convocatoria: A partir del día siguiente a publicación en BORM\nFin de convocatoria: \n\n\nDetalle de la convocatoria de ayuda o  subvención: 803871\nEnlace a convocatoria: https://www.pap.hacienda.gob.es/bdnstrans/GE/es/convocatorias/803871\nÓrgano, comunidad, autonomía, provincia o ayuntamiento convocante: REGIÓN DE MURCIA - INSTITUTO DE INDUSTRIAS CULTURALES Y DE LAS ARTES DE LA REGIÓN DE MURCIA ( ICA )\nFecha de recepción: 2024-12-18T12:56:07+01:00\nTipo de ayuda: SUBVENCIÓN Y ENTREGA DINERARIA SIN CONTRAPRESTACIÓN \nTipo de convocatoria: Concurrencia competitiva - canónica\nPresupuesto total: 110000 Euros\nDescripción: RESOLUCIÓN DE LA DIRECCIÓN GENERAL DEL INSTITUTO DE LAS INDUSTRIAS CULTURALES Y LAS ARTES POR LA QUE SE CONVOCA LA CONCESIÓN DE SUBVENCIONES, EN RÉGIMEN DE CONCURRENCIA COMPETITIVA, DE PLAN ESCENA NACIONAL E INTERNACIONAL, EN SU EDICIÓN 2025\nTipos de beneficiarios: PYME Y PERSONAS FÍSICAS QUE DESARROLLAN ACTIVIDAD ECONÓMICA\nSectores involucrados: ACTIVIDADES ARTÍSTICAS, RECREATIVAS Y DE ENTRETENIMIENTO\nRegión de impacto: ES62 - REGION DE MURCIA\nFinalidad: Cultura\nBases reguladoras: Modificada por Orden de 7 de octubre de 2019, de la Consejera de Educación y Cultura (BORM nº 247, de 25 de octubre de 2019)\nPublicación en diario oficial: Sí\nEstado de convocatoria abierta: No\nInicio de convocatoria: A partir del día siguiente a publicación en el BORM\nFin de convocatoria: \n\n\nDetalle de la convocatoria de ayuda o  subvención: 803757\nEnlace a convocatoria: https://www.pap.hacienda.gob.es/bdnstrans/GE/es/convocatorias/803757\nÓrgano, comunidad, autonomía, provincia o ayuntamiento convocante: CATALUÑA - DEPARTAMENT D'EDUCACIÓ I FORMACIÓ PROFESSIONAL\nFecha de recepción: 2024-12-18T09:51:12+01:00\nTipo de ayuda: SUBVENCIÓN Y ENTREGA DINERARIA SIN CONTRAPRESTACIÓN \nTipo de convocatoria: Concurrencia competitiva - canónica\nPresupuesto total: 15000000 Euros\nDescripción: Subvenciones destinadas a la escolarización de niños de cero a tres años en las guarderías infantiles de titularidad privada, para el curso 2024-2025\nTipos de beneficiarios: PERSONAS JURÍDICAS QUE NO DESARROLLAN ACTIVIDAD ECONÓMICA\nSectores involucrados: Educación preprimaria\nRegión de impacto: ES51 - CATALUÑA\nFinalidad: Educación\nBases reguladoras: ORDEN por la que se aprueban las bases reguladoras del procedimiento de concesión de subvenciones destinadas a la escolarización de niños de cero a tres años en las guarderías infantiles de titularidad privada, para el curso 2024-2025.\nPublicación en diario oficial: Sí\nEstado de convocatoria abierta: No\nInicio de convocatoria: \nFin de convocatoria: \n\n"
        ]
    },
    {
        "user_input": "y en ELKARTEARI?",
        "reference": "",
        "response": "**Convocatoria de Ayuda: 803871**\n- **Órgano convocante:** REGIÓN DE MURCIA - INSTITUTO DE INDUSTRIAS CULTURALES Y DE LAS ARTES DE LA REGIÓN DE MURCIA (ICA)\n- **Enlace a la convocatoria:** [Acceder](https://www.pap.hacienda.gob.es/bdnstrans/GE/es/convocatorias/803871)\n- **Sede electrónica para presentar solicitud:** No disponible.\n- **Presupuesto total:** 110,000 Euros\n- **Descripción:** RESOLUCIÓN DE LA DIRECCIÓN GENERAL DEL INSTITUTO DE LAS INDUSTRIAS CULTURALES Y LAS ARTES POR LA QUE SE CONVOCA LA CONCESIÓN DE SUBVENCIONES, EN RÉGIMEN DE CONCURRENCIA COMPETITIVA, DE PLAN ESCENA NACIONAL E INTERNACIONAL, EN SU EDICIÓN 2025\n- **Beneficiarios:** PYME Y PERSONAS FÍSICAS QUE DESARROLLAN ACTIVIDAD ECONÓMICA\n- **Sectores involucrados:** ACTIVIDADES ARTÍSTICAS, RECREATIVAS Y DE ENTRETENIMIENTO\n- **Región de impacto:** ES62 - REGIÓN DE MURCIA\n- **Estado de convocatoria:** Abierta.\n- **Fechas importantes:**\n  - **Inicio solicitudes:** A partir del día siguiente a publicación en el BORM\n  - **Fin solicitudes:** No disponible.\n\n---\n\n**Convocatoria de Ayuda: 803866**\n- **Órgano convocante:** REGIÓN DE MURCIA - INSTITUTO DE INDUSTRIAS CULTURALES Y DE LAS ARTES DE LA REGIÓN DE MURCIA (ICA)\n- **Enlace a la convocatoria:** [Acceder](https://www.pap.hacienda.gob.es/bdnstrans/GE/es/convocatorias/803866)\n- **Sede electrónica para presentar solicitud:** No disponible.\n- **Presupuesto total:** 150,000 Euros\n- **Descripción:** RESOLUCIÓN DEL DIRECTOR GENERAL DEL INSTITUTO DE LAS INDUSTRIAS CULTURALES Y LAS ARTES DE LA REGIÓN DE MURCIA QUE CONVOCA AYUDAS EN RÉGIMEN DE CONCURRENCIA NO COMPETITIVA PARA GIRAS DE MÚSICA EN VIVO DE ÁMBITO NACIONAL E INTERNACIONAL\n- **Beneficiarios:** PYME Y PERSONAS FÍSICAS QUE DESARROLLAN ACTIVIDAD ECONÓMICA\n- **Sectores involucrados:** ACTIVIDADES ARTÍSTICAS, RECREATIVAS Y DE ENTRETENIMIENTO\n- **Región de impacto:** ES62 - REGIÓN DE MURCIA\n- **Estado de convocatoria:** Abierta.\n- **Fechas importantes:**\n  - **Inicio solicitudes:** A partir del día siguiente a publicación en BORM\n  - **Fin solicitudes:** No disponible.\n\n---\n\n**Convocatoria de Ayuda: 803613**\n- **Órgano convocante:** ILLES BALEARS - FONDO DE GARANTÍA AGRARIA Y PESQUERA DE LAS ISLAS BALEARES (FOGAIBA)\n- **Enlace a la convocatoria:** [Acceder](https://www.pap.hacienda.gob.es/bdnstrans/GE/es/convocatorias/803613)\n- **Sede electrónica para presentar solicitud:** No disponible.\n- **Presupuesto total:** 140,000 Euros\n- **Descripción:** Ayudas de minimis para el fomento de la recría del ganado bovino lechero, inscrito en los libros genealógicos, a las explotaciones de las Illes Balears para el año 2024.\n- **Beneficiarios:** PYME Y PERSONAS FÍSICAS QUE DESARROLLAN ACTIVIDAD ECONÓMICA\n- **Sectores involucrados:** Agricultura, ganadería, caza y servicios relacionados con las mismas\n- **Región de impacto:** ES53 - ILLES BALEARS\n- **Estado de convocatoria:** Abierta.\n- **Fechas importantes:**\n  - **Inicio solicitudes:** No disponible.\n  - **Fin solicitudes:** No disponible.\n\n---\n\n**Convocatoria de Ayuda: 803987**\n- **Órgano convocante:** ARCHIDONA - AYUNTAMIENTO DE ARCHIDONA\n- **Enlace a la convocatoria:** [Acceder](https://www.pap.hacienda.gob.es/bdnstrans/GE/es/convocatorias/803987)\n- **Sede electrónica para presentar solicitud:** No disponible.\n- **Presupuesto total:** 600 Euros\n- **Descripción:** Resolución_de Alcaldía_núm 2024-1614 de 18 de diciembre. Aprobar Bases Reguladoras y efectuar Convocatoria Concurso Cartel Anunciador Carnaval 2025. Archidona\n- **Beneficiarios:** PERSONAS FÍSICAS QUE NO DESARROLLAN ACTIVIDAD ECONÓMICA\n- **Sectores involucrados:** Actividades de creación, artísticas y espectáculos\n- **Región de impacto:** ES617 - Málaga\n- **Estado de convocatoria:** Abierta.\n- **Fechas importantes:**\n  - **Inicio solicitudes:** Desde el día siguiente a la publicación del extracto de la convocatoria en el BOPMA\n  - **Fin solicitudes:** No disponible.",
        "retrieved_contexts": [
            "Detalle de la convocatoria\nInformación de la convocatoria\nÓrgano convocante\nGERNIKA-LUMO AYUNTAMIENTO DE GERNIKA-LUMOSede electrónica para la presentación de solicitudes\nTítulo de la convocatoria en español\nTítulo de la convocatoria en otra lengua cooficial\nGORABIDE ELKARTEARI 2024KO DIRULAGUNTZA\nTipo de beneficiario elegible Sector económico del beneficiario Región de impacto Finalidad (política de gasto)\nServicios Sociales y Promoción Social ES213 - Bizkaia PERSONAS JURÍDICAS QUE NO DESARROLLAN\nACTIVIDAD ECONÓMICAAsistencia en establecimientos residenciales para\npersonas con discapacidad intelectual, enfermedad\nmental y drogodependenciaSUBVENCION 2024 ASOCIACION GORABIDE\nTítulo de las bases reguladoras\nSUBVENCION 2024 ASOCIACION GORABIDEDirección electrónica de las bases reguladoras\nhttps://www.bizkaia.eus/lehendakaritza/Bao_bob/2012/12/2\n0121219a242.pdf?hash=0182fbb1795636249a60124af57a27 45#page=12SUBVENCIÓN Y ENTREGA DINERARIA SIN CONTRAPRESTACIÓNInstrumento de ayuda\nConcesión directa - instrumentalTipo de convocatoria\n22.000,00 €Presupuesto total de la convocatoria804947Código BDNS\nNOMecanismo de Recuperación y Resiliencia\n20/12/2024Fecha de registro\n1Página de321/12/2024Detalle de la convocatoria\nInformación sobre la solicitud\n¿El extracto de la convocatoria se publica en diario oficial?\nNo¿Se puede solicitar indefinidamente?\nNo\nFecha de inicio del periodo de solicitud\n01/01/2024Fecha de finalización del periodo de solicitud\n31/12/2024\nInformación específica sobre Ayudas de Estado y de minimis\nSA Number (Referencia de Ayuda de Estado) SA Number (Enlace UE) ¿Cofinanciado con fondos UE?\nNo\nReglamento (UE) Objetivos Sector de productos\n2Página de321/12/2024Detalle de la convocatoria\nInformación del extracto de la convocatoria\n3Página de321/12/2024\n\nDetalle de la convocatoria de ayuda o  subvención: 803871\nEnlace a convocatoria: https://www.pap.hacienda.gob.es/bdnstrans/GE/es/convocatorias/803871\nÓrgano, comunidad, autonomía, provincia o ayuntamiento convocante: REGIÓN DE MURCIA - INSTITUTO DE INDUSTRIAS CULTURALES Y DE LAS ARTES DE LA REGIÓN DE MURCIA ( ICA )\nFecha de recepción: 2024-12-18T12:56:07+01:00\nTipo de ayuda: SUBVENCIÓN Y ENTREGA DINERARIA SIN CONTRAPRESTACIÓN \nTipo de convocatoria: Concurrencia competitiva - canónica\nPresupuesto total: 110000 Euros\nDescripción: RESOLUCIÓN DE LA DIRECCIÓN GENERAL DEL INSTITUTO DE LAS INDUSTRIAS CULTURALES Y LAS ARTES POR LA QUE SE CONVOCA LA CONCESIÓN DE SUBVENCIONES, EN RÉGIMEN DE CONCURRENCIA COMPETITIVA, DE PLAN ESCENA NACIONAL E INTERNACIONAL, EN SU EDICIÓN 2025\nTipos de beneficiarios: PYME Y PERSONAS FÍSICAS QUE DESARROLLAN ACTIVIDAD ECONÓMICA\nSectores involucrados: ACTIVIDADES ARTÍSTICAS, RECREATIVAS Y DE ENTRETENIMIENTO\nRegión de impacto: ES62 - REGION DE MURCIA\nFinalidad: Cultura\nBases reguladoras: Modificada por Orden de 7 de octubre de 2019, de la Consejera de Educación y Cultura (BORM nº 247, de 25 de octubre de 2019)\nPublicación en diario oficial: Sí\nEstado de convocatoria abierta: No\nInicio de convocatoria: A partir del día siguiente a publicación en el BORM\nFin de convocatoria: \n\n\nDetalle de la convocatoria de ayuda o  subvención: 803866\nEnlace a convocatoria: https://www.pap.hacienda.gob.es/bdnstrans/GE/es/convocatorias/803866\nÓrgano, comunidad, autonomía, provincia o ayuntamiento convocante: REGIÓN DE MURCIA - INSTITUTO DE INDUSTRIAS CULTURALES Y DE LAS ARTES DE LA REGIÓN DE MURCIA ( ICA )\nFecha de recepción: 2024-12-18T12:45:38+01:00\nTipo de ayuda: SUBVENCIÓN Y ENTREGA DINERARIA SIN CONTRAPRESTACIÓN \nTipo de convocatoria: Concurrencia competitiva - canónica\nPresupuesto total: 150000 Euros\nDescripción: RESOLUCIÓN DEL DIRECTOR GENERAL DEL INSTITUTO DE LAS INDUSTRIAS CULTURALES Y LAS ARTES DE LA REGIÓN DE MURCIA QUE CONVOCA AYUDAS EN RÉGIMEN DE CONCURRENCIA NO COMPETITIVA PARA GIRAS DE MÚSICA EN VIVO DE ÁMBITO NACIONAL E INTERNACIONAL\nTipos de beneficiarios: PYME Y PERSONAS FÍSICAS QUE DESARROLLAN ACTIVIDAD ECONÓMICA\nSectores involucrados: ACTIVIDADES ARTÍSTICAS, RECREATIVAS Y DE ENTRETENIMIENTO\nRegión de impacto: ES62 - REGION DE MURCIA\nFinalidad: Cultura\nBases reguladoras: Orden de 27 de mayo de 2016 de la Consejería de Cultura y Portavocía (BORM nº 126, de 1 de junio), Modificada por Orden de 7 de octubre de 2019, de la Consejera de Educación y Cultura (BORM nº 247, de 25 de octubre de 2019)\nPublicación en diario oficial: Sí\nEstado de convocatoria abierta: No\nInicio de convocatoria: A partir del día siguiente a publicación en BORM\nFin de convocatoria: \n\n\nDetalle de la convocatoria de ayuda o  subvención: 803613\nEnlace a convocatoria: https://www.pap.hacienda.gob.es/bdnstrans/GE/es/convocatorias/803613\nÓrgano, comunidad, autonomía, provincia o ayuntamiento convocante: ILLES BALEARS - FONDO DE GARANTÍA AGRARIA Y PESQUERA DE LAS ISLAS BALEARES (FOGAIBA)\nFecha de recepción: 2024-12-17T14:11:40+01:00\nTipo de ayuda: SUBVENCIÓN Y ENTREGA DINERARIA SIN CONTRAPRESTACIÓN \nTipo de convocatoria: Concurrencia competitiva - canónica\nPresupuesto total: 140000 Euros\nDescripción: Ayudas de minimis para el fomento de la recría del ganado bovino lechero, inscrito en los libros genealógicos, a las explotaciones de las Illes Balears para el año 2024.\nTipos de beneficiarios: PYME Y PERSONAS FÍSICAS QUE DESARROLLAN ACTIVIDAD ECONÓMICA\nSectores involucrados: Agricultura, ganadería, caza y servicios relacionados con las mismas\nRegión de impacto: ES53 - ILLES BALEARS\nFinalidad: Agricultura, Pesca y Alimentación\nBases reguladoras: Orden de la Consejera de Agricultura y Pesca, de 10 de marzo de 2005, por la que se establecen las bases reguladoras de las subvenciones a los sectores agrario y pesquero.\nPublicación en diario oficial: Sí\nEstado de convocatoria abierta: No\nInicio de convocatoria: \nFin de convocatoria: \n\n\nDetalle de la convocatoria de ayuda o  subvención: 803987\nEnlace a convocatoria: https://www.pap.hacienda.gob.es/bdnstrans/GE/es/convocatorias/803987\nÓrgano, comunidad, autonomía, provincia o ayuntamiento convocante: ARCHIDONA - AYUNTAMIENTO DE ARCHIDONA\nFecha de recepción: 2024-12-18T14:48:55+01:00\nTipo de ayuda: SUBVENCIÓN Y ENTREGA DINERARIA SIN CONTRAPRESTACIÓN \nTipo de convocatoria: Concurrencia competitiva - canónica\nPresupuesto total: 600 Euros\nDescripción: Resolución_de Alcaldía_núm 2024-1614 de 18 de diciembre. Aprobar Bases Reguladoras y efectuar Convocatoria Concurso Cartel Anunciador Carnaval 2025. Archidona\nTipos de beneficiarios: PERSONAS FÍSICAS QUE NO DESARROLLAN ACTIVIDAD ECONÓMICA\nSectores involucrados: Actividades de creación, artísticas y espectáculos\nRegión de impacto: ES617 - Málaga\nFinalidad: Cultura\nBases reguladoras: Resolución_de Alcaldía_núm 2024-1614 de 18 de diciembre. Aprobar Bases Reguladoras y efectuar Convocatoria Concurso Cartel Anunciador Carnaval 2025. Archidona\nPublicación en diario oficial: Sí\nEstado de convocatoria abierta: No\nInicio de convocatoria: Desde el día siguiente a la publicación del extracto de la convocatoria en el BOPMA\nFin de convocatoria: \n\n"
        ]
    },
    {
        "user_input": "GERNIKA-LUMO",
        "reference": "",
        "response": "**Convocatoria de Ayuda: 803870**\n- **Órgano convocante:** GERNIKA-LUMO AYUNTAMIENTO DE GERNIKA-LUMO\n- **Enlace a la convocatoria:** [Acceder](https://www.pap.hacienda.gob.es/bdnstrans/GE/es/convocatorias/803870)\n- **Sede electrónica para presentar solicitud:** No disponible\n- **Presupuesto total:** 22,000 Euros\n- **Descripción:** Subvenciones para asistencia en establecimientos residenciales para personas con discapacidad intelectual, enfermedad mental y drogodependencia.\n- **Beneficiarios:** PERSONAS JURÍDICAS QUE NO DESARROLLAN ACTIVIDAD ECONÓMICA\n- **Sectores involucrados:** Servicios Sociales y Promoción Social \n- **Región de impacto:** ES213 - Bizkaia\n- **Estado de convocatoria:** No abierta.\n- **Fechas importantes:**\n  - **Inicio solicitudes:** 01/01/2024\n  - **Fin solicitudes:** 31/12/2024\n  - **Publicación en diario oficial:** No disponible",
        "retrieved_contexts": [
            "Detalle de la convocatoria\nInformación de la convocatoria\nÓrgano convocante\nGERNIKA-LUMO AYUNTAMIENTO DE GERNIKA-LUMOSede electrónica para la presentación de solicitudes\nTítulo de la convocatoria en español\nTítulo de la convocatoria en otra lengua cooficial\nGORABIDE ELKARTEARI 2024KO DIRULAGUNTZA\nTipo de beneficiario elegible Sector económico del beneficiario Región de impacto Finalidad (política de gasto)\nServicios Sociales y Promoción Social ES213 - Bizkaia PERSONAS JURÍDICAS QUE NO DESARROLLAN\nACTIVIDAD ECONÓMICAAsistencia en establecimientos residenciales para\npersonas con discapacidad intelectual, enfermedad\nmental y drogodependenciaSUBVENCION 2024 ASOCIACION GORABIDE\nTítulo de las bases reguladoras\nSUBVENCION 2024 ASOCIACION GORABIDEDirección electrónica de las bases reguladoras\nhttps://www.bizkaia.eus/lehendakaritza/Bao_bob/2012/12/2\n0121219a242.pdf?hash=0182fbb1795636249a60124af57a27 45#page=12SUBVENCIÓN Y ENTREGA DINERARIA SIN CONTRAPRESTACIÓNInstrumento de ayuda\nConcesión directa - instrumentalTipo de convocatoria\n22.000,00 €Presupuesto total de la convocatoria804947Código BDNS\nNOMecanismo de Recuperación y Resiliencia\n20/12/2024Fecha de registro\n1Página de321/12/2024Detalle de la convocatoria\nInformación sobre la solicitud\n¿El extracto de la convocatoria se publica en diario oficial?\nNo¿Se puede solicitar indefinidamente?\nNo\nFecha de inicio del periodo de solicitud\n01/01/2024Fecha de finalización del periodo de solicitud\n31/12/2024\nInformación específica sobre Ayudas de Estado y de minimis\nSA Number (Referencia de Ayuda de Estado) SA Number (Enlace UE) ¿Cofinanciado con fondos UE?\nNo\nReglamento (UE) Objetivos Sector de productos\n2Página de321/12/2024Detalle de la convocatoria\nInformación del extracto de la convocatoria\n3Página de321/12/2024\n\nDetalle de la convocatoria de ayuda o  subvención: 803871\nEnlace a convocatoria: https://www.pap.hacienda.gob.es/bdnstrans/GE/es/convocatorias/803871\nÓrgano, comunidad, autonomía, provincia o ayuntamiento convocante: REGIÓN DE MURCIA - INSTITUTO DE INDUSTRIAS CULTURALES Y DE LAS ARTES DE LA REGIÓN DE MURCIA ( ICA )\nFecha de recepción: 2024-12-18T12:56:07+01:00\nTipo de ayuda: SUBVENCIÓN Y ENTREGA DINERARIA SIN CONTRAPRESTACIÓN \nTipo de convocatoria: Concurrencia competitiva - canónica\nPresupuesto total: 110000 Euros\nDescripción: RESOLUCIÓN DE LA DIRECCIÓN GENERAL DEL INSTITUTO DE LAS INDUSTRIAS CULTURALES Y LAS ARTES POR LA QUE SE CONVOCA LA CONCESIÓN DE SUBVENCIONES, EN RÉGIMEN DE CONCURRENCIA COMPETITIVA, DE PLAN ESCENA NACIONAL E INTERNACIONAL, EN SU EDICIÓN 2025\nTipos de beneficiarios: PYME Y PERSONAS FÍSICAS QUE DESARROLLAN ACTIVIDAD ECONÓMICA\nSectores involucrados: ACTIVIDADES ARTÍSTICAS, RECREATIVAS Y DE ENTRETENIMIENTO\nRegión de impacto: ES62 - REGION DE MURCIA\nFinalidad: Cultura\nBases reguladoras: Modificada por Orden de 7 de octubre de 2019, de la Consejera de Educación y Cultura (BORM nº 247, de 25 de octubre de 2019)\nPublicación en diario oficial: Sí\nEstado de convocatoria abierta: No\nInicio de convocatoria: A partir del día siguiente a publicación en el BORM\nFin de convocatoria: \n\n\nDetalle de la convocatoria de ayuda o  subvención: 803866\nEnlace a convocatoria: https://www.pap.hacienda.gob.es/bdnstrans/GE/es/convocatorias/803866\nÓrgano, comunidad, autonomía, provincia o ayuntamiento convocante: REGIÓN DE MURCIA - INSTITUTO DE INDUSTRIAS CULTURALES Y DE LAS ARTES DE LA REGIÓN DE MURCIA ( ICA )\nFecha de recepción: 2024-12-18T12:45:38+01:00\nTipo de ayuda: SUBVENCIÓN Y ENTREGA DINERARIA SIN CONTRAPRESTACIÓN \nTipo de convocatoria: Concurrencia competitiva - canónica\nPresupuesto total: 150000 Euros\nDescripción: RESOLUCIÓN DEL DIRECTOR GENERAL DEL INSTITUTO DE LAS INDUSTRIAS CULTURALES Y LAS ARTES DE LA REGIÓN DE MURCIA QUE CONVOCA AYUDAS EN RÉGIMEN DE CONCURRENCIA NO COMPETITIVA PARA GIRAS DE MÚSICA EN VIVO DE ÁMBITO NACIONAL E INTERNACIONAL\nTipos de beneficiarios: PYME Y PERSONAS FÍSICAS QUE DESARROLLAN ACTIVIDAD ECONÓMICA\nSectores involucrados: ACTIVIDADES ARTÍSTICAS, RECREATIVAS Y DE ENTRETENIMIENTO\nRegión de impacto: ES62 - REGION DE MURCIA\nFinalidad: Cultura\nBases reguladoras: Orden de 27 de mayo de 2016 de la Consejería de Cultura y Portavocía (BORM nº 126, de 1 de junio), Modificada por Orden de 7 de octubre de 2019, de la Consejera de Educación y Cultura (BORM nº 247, de 25 de octubre de 2019)\nPublicación en diario oficial: Sí\nEstado de convocatoria abierta: No\nInicio de convocatoria: A partir del día siguiente a publicación en BORM\nFin de convocatoria: \n\n\nDetalle de la convocatoria de ayuda o  subvención: 803613\nEnlace a convocatoria: https://www.pap.hacienda.gob.es/bdnstrans/GE/es/convocatorias/803613\nÓrgano, comunidad, autonomía, provincia o ayuntamiento convocante: ILLES BALEARS - FONDO DE GARANTÍA AGRARIA Y PESQUERA DE LAS ISLAS BALEARES (FOGAIBA)\nFecha de recepción: 2024-12-17T14:11:40+01:00\nTipo de ayuda: SUBVENCIÓN Y ENTREGA DINERARIA SIN CONTRAPRESTACIÓN \nTipo de convocatoria: Concurrencia competitiva - canónica\nPresupuesto total: 140000 Euros\nDescripción: Ayudas de minimis para el fomento de la recría del ganado bovino lechero, inscrito en los libros genealógicos, a las explotaciones de las Illes Balears para el año 2024.\nTipos de beneficiarios: PYME Y PERSONAS FÍSICAS QUE DESARROLLAN ACTIVIDAD ECONÓMICA\nSectores involucrados: Agricultura, ganadería, caza y servicios relacionados con las mismas\nRegión de impacto: ES53 - ILLES BALEARS\nFinalidad: Agricultura, Pesca y Alimentación\nBases reguladoras: Orden de la Consejera de Agricultura y Pesca, de 10 de marzo de 2005, por la que se establecen las bases reguladoras de las subvenciones a los sectores agrario y pesquero.\nPublicación en diario oficial: Sí\nEstado de convocatoria abierta: No\nInicio de convocatoria: \nFin de convocatoria: \n\n\nDetalle de la convocatoria de ayuda o  subvención: 803720\nEnlace a convocatoria: https://www.pap.hacienda.gob.es/bdnstrans/GE/es/convocatorias/803720\nÓrgano, comunidad, autonomía, provincia o ayuntamiento convocante: CASTILLA-LA MANCHA - INSTITUTO DE LA MUJER DE CASTILLA-LA MANCHA\nFecha de recepción: 2024-12-18T08:56:34+01:00\nTipo de ayuda: SUBVENCIÓN Y ENTREGA DINERARIA SIN CONTRAPRESTACIÓN \nTipo de convocatoria: Concurrencia competitiva - canónica\nPresupuesto total: 34000 Euros\nDescripción: Resolución de 17 de diciembre de 2024, del Instituto de la Mujer de Castilla-La Mancha por la que se convoca la III edición de los Premios de Castilla-La Mancha Mujeres en el Cine \"Alice Guy\".         \n     \n         \n     \n\nTipos de beneficiarios: PERSONAS JURÍDICAS QUE NO DESARROLLAN ACTIVIDAD ECONÓMICA\nSectores involucrados: ACTIVIDADES SANITARIAS Y DE SERVICIOS SOCIALES\nRegión de impacto: ES42 - CASTILLA LA MANCHA\nFinalidad: Servicios Sociales y Promoción Social\nBases reguladoras: Orden 205/2022, de 26 de octubre, de la Consejería de Igualdad y Portavoz, por la que se establecen las bases reguladoras de los premios Castilla-LaMancha en el cine Alice Guy\nPublicación en diario oficial: Sí\nEstado de convocatoria abierta: Sí\nInicio de convocatoria: a partir del día siguiente a la publicación\nFin de convocatoria: un mes, contado a partir del día siguiente a la publicación\n\n"
        ]
    },
    {
        "user_input": "ayuntamiento de gernika-lumo",
        "reference": "",
        "response": "**Convocatoria de Ayuda: 804947**\n- **Órgano convocante:** Gernika-Lumo - Ayuntamiento de Gernika-Lumo\n- **Enlace a la convocatoria:** [Acceder](https://www.bizkaia.eus/lehendakaritza/bao_bob/2012/12/20121219a242.pdf?hash=0182fbb1795636249a60124af57a2745#page=12)\n- **Sede electrónica para presentar solicitud:** No se proporciona enlace específico.\n- **Presupuesto total:** 22,000.00 Euros\n- **Descripción:** Subvenciones para asistencia en establecimientos residenciales para personas con discapacidad intelectual, enfermedad mental y drogodependencia.\n- **Beneficiarios:** Personas jurídicas que no desarrollan actividad económica.\n- **Sectores involucrados:** Servicios sociales y promoción social.\n- **Región de impacto:** Bizkaia.\n- **Estado de convocatoria:** Abierta.\n- **Fechas importantes:**\n  - Inicio solicitudes: 01/01/2024\n  - Fin solicitudes: 31/12/2024\n- **Documentos relevantes:** \n  - **Bases reguladoras:** [Ver Bases](https://www.bizkaia.eus/lehendakaritza/bao_bob/2012/12/20121219a242.pdf?hash=0182fbb1795636249a60124af57a2745#page=12)",
        "retrieved_contexts": [
            "detalle de la convocatoria información de la convocatoria órgano convocante gernika-lumo ayuntamiento de gernika-lumo sede electrónica para la presentación de solicitudes título de la convocatoria en español título de la convocatoria en otra lengua cooficial gorabide elkarteari 2024ko dirulaguntza tipo de beneficiario elegible sector económico del beneficiario región de impacto finalidad (política de gasto) servicios sociales y promoción sociales213 - bizkaiapersonas jurídicas que no desarrollan actividad económica asistencia en establecimientos residenciales para personas con discapacidad intelectual, enfermedad mental y drogodependencia subvencion 2024 asociacion gorabide título de las bases reguladoras subvencion 2024 asociacion gorabide dirección electrónica de las bases reguladoras https://www.bizkaia.eus/lehendakaritza/bao_bob/2012/12/2 0121219a242.pdf?hash=0182fbb1795636249a60124af57a27 45#page=12 subvención y entrega dineraria sin contraprestación instrumento de ayuda concesión directa - instrumental tipo de convocatoria 22.000,00 € presupuesto total de la convocatoria 804947 código bdns no mecanismo de recuperación y resiliencia 20/12/2024 fecha de registro 1página de 3 21/12/2024 detalle de la convocatoria información sobre la solicitud ¿el extracto de la convocatoria se publica en diario oficial? no ¿se puede solicitar indefinidamente? no fecha de inicio del periodo de solicitud 01/01/2024 fecha de finalización del periodo de solicitud 31/12/2024 información específica sobre ayudas de estado y de minimis sa number (referencia de ayuda de estado) sa number (enlace ue) ¿cofinanciado con fondos ue? no reglamento (ue) objetivos sector de productos 2página de 3 21/12/2024 detalle de la convocatoria información del extracto de la convocatoria 3página de 3 21/12/2024 \ndetalle de la convocatoria información de la convocatoria órgano convocante gernika-lumo ayuntamiento de gernika-lumo sede electrónica para la presentación de solicitudes título de la convocatoria en español título de la convocatoria en otra lengua cooficial gorabide elkarteari 2024ko dirulaguntza tipo de beneficiario elegible sector económico del beneficiario región de impacto finalidad (política de gasto) servicios sociales y promoción sociales213 - bizkaiapersonas jurídicas que no desarrollan actividad económica asistencia en establecimientos residenciales para personas con discapacidad intelectual, enfermedad mental y drogodependencia subvencion 2024 asociacion gorabide título de las bases reguladoras subvencion 2024 asociacion gorabide dirección electrónica de las bases reguladoras https://www.bizkaia.eus/lehendakaritza/bao_bob/2012/12/2 0121219a242.pdf?hash=0182fbb1795636249a60124af57a27 45#page=12 subvención y entrega dineraria sin contraprestación instrumento de ayuda concesión directa - instrumental tipo de convocatoria 22.000,00 € presupuesto total de la convocatoria 804947 código bdns no mecanismo de recuperación y resiliencia 20/12/2024 fecha de registro 1página de 3 21/12/2024 detalle de la convocatoria información sobre la solicitud ¿el extracto de la convocatoria se publica en diario oficial? no ¿se puede solicitar indefinidamente? no fecha de inicio del periodo de solicitud 01/01/2024 fecha de finalización del periodo de solicitud 31/12/2024 información específica sobre ayudas de estado y de minimis sa number (referencia de ayuda de estado) sa number (enlace ue) ¿cofinanciado con fondos ue? no reglamento (ue) objetivos sector de productos 2página de 3 21/12/2024 detalle de la convocatoria información del extracto de la convocatoria 3página de 3 21/12/2024 \ndetalle de la convocatoria información de la convocatoria órgano convocante gernika-lumo ayuntamiento de gernika-lumo sede electrónica para la presentación de solicitudes título de la convocatoria en español título de la convocatoria en otra lengua cooficial gorabide elkarteari 2024ko dirulaguntza tipo de beneficiario elegible sector económico del beneficiario región de impacto finalidad (política de gasto) servicios sociales y promoción sociales213 - bizkaiapersonas jurídicas que no desarrollan actividad económica asistencia en establecimientos residenciales para personas con discapacidad intelectual, enfermedad mental y drogodependencia subvencion 2024 asociacion gorabide título de las bases reguladoras subvencion 2024 asociacion gorabide dirección electrónica de las bases reguladoras https://www.bizkaia.eus/lehendakaritza/bao_bob/2012/12/2 0121219a242.pdf?hash=0182fbb1795636249a60124af57a27 45#page=12 subvención y entrega dineraria sin contraprestación instrumento de ayuda concesión directa - instrumental tipo de convocatoria 22.000,00 € presupuesto total de la convocatoria 804947 código bdns no mecanismo de recuperación y resiliencia 20/12/2024 fecha de registro 1página de 3 21/12/2024 detalle de la convocatoria información sobre la solicitud ¿el extracto de la convocatoria se publica en diario oficial? no ¿se puede solicitar indefinidamente? no fecha de inicio del periodo de solicitud 01/01/2024 fecha de finalización del periodo de solicitud 31/12/2024 información específica sobre ayudas de estado y de minimis sa number (referencia de ayuda de estado) sa number (enlace ue) ¿cofinanciado con fondos ue? no reglamento (ue) objetivos sector de productos 2página de 3 21/12/2024 detalle de la convocatoria información del extracto de la convocatoria 3página de 3 21/12/2024 \ndetalle de la convocatoria información de la convocatoria órgano convocante gernika-lumo ayuntamiento de gernika-lumo sede electrónica para la presentación de solicitudes título de la convocatoria en español título de la convocatoria en otra lengua cooficial gorabide elkarteari 2024ko dirulaguntza tipo de beneficiario elegible sector económico del beneficiario región de impacto finalidad (política de gasto) servicios sociales y promoción sociales213 - bizkaiapersonas jurídicas que no desarrollan actividad económica asistencia en establecimientos residenciales para personas con discapacidad intelectual, enfermedad mental y drogodependencia subvencion 2024 asociacion gorabide título de las bases reguladoras subvencion 2024 asociacion gorabide dirección electrónica de las bases reguladoras https://www.bizkaia.eus/lehendakaritza/bao_bob/2012/12/2 0121219a242.pdf?hash=0182fbb1795636249a60124af57a27 45#page=12 subvención y entrega dineraria sin contraprestación instrumento de ayuda concesión directa - instrumental tipo de convocatoria 22.000,00 € presupuesto total de la convocatoria 804947 código bdns no mecanismo de recuperación y resiliencia 20/12/2024 fecha de registro 1página de 3 21/12/2024 detalle de la convocatoria información sobre la solicitud ¿el extracto de la convocatoria se publica en diario oficial? no ¿se puede solicitar indefinidamente? no fecha de inicio del periodo de solicitud 01/01/2024 fecha de finalización del periodo de solicitud 31/12/2024 información específica sobre ayudas de estado y de minimis sa number (referencia de ayuda de estado) sa number (enlace ue) ¿cofinanciado con fondos ue? no reglamento (ue) objetivos sector de productos 2página de 3 21/12/2024 detalle de la convocatoria información del extracto de la convocatoria 3página de 3 21/12/2024 \ndetalle de la convocatoria información de la convocatoria órgano convocante gernika-lumo ayuntamiento de gernika-lumo sede electrónica para la presentación de solicitudes título de la convocatoria en español título de la convocatoria en otra lengua cooficial gorabide elkarteari 2024ko dirulaguntza tipo de beneficiario elegible sector económico del beneficiario región de impacto finalidad (política de gasto) servicios sociales y promoción sociales213 - bizkaiapersonas jurídicas que no desarrollan actividad económica asistencia en establecimientos residenciales para personas con discapacidad intelectual, enfermedad mental y drogodependencia subvencion 2024 asociacion gorabide título de las bases reguladoras subvencion 2024 asociacion gorabide dirección electrónica de las bases reguladoras https://www.bizkaia.eus/lehendakaritza/bao_bob/2012/12/2 0121219a242.pdf?hash=0182fbb1795636249a60124af57a27 45#page=12 subvención y entrega dineraria sin contraprestación instrumento de ayuda concesión directa - instrumental tipo de convocatoria 22.000,00 € presupuesto total de la convocatoria 804947 código bdns no mecanismo de recuperación y resiliencia 20/12/2024 fecha de registro 1página de 3 21/12/2024 detalle de la convocatoria información sobre la solicitud ¿el extracto de la convocatoria se publica en diario oficial? no ¿se puede solicitar indefinidamente? no fecha de inicio del periodo de solicitud 01/01/2024 fecha de finalización del periodo de solicitud 31/12/2024 información específica sobre ayudas de estado y de minimis sa number (referencia de ayuda de estado) sa number (enlace ue) ¿cofinanciado con fondos ue? no reglamento (ue) objetivos sector de productos 2página de 3 21/12/2024 detalle de la convocatoria información del extracto de la convocatoria 3página de 3 21/12/2024 \n"
        ]
    }
]