[
    {
        "user_input": "puedes mostrarme la primera ayuda?",
        "reference": "",
        "response": "**Convocatoria de Ayuda: 803034**\n- **Órgano convocante:** BORRIANA/BURRIANA - AYUNTAMIENTO DE BORRIANA/BURRIANA\n- **Enlace a la convocatoria:** [Acceder](https://www.pap.hacienda.gob.es/bdnstrans/GE/es/convocatorias/803034)\n- **Presupuesto total:** 1200 Euros\n- **Descripción:** Concurso de belenes ciudad de Burriana 2024\n- **Beneficiarios:** Personas físicas que no desarrollan actividad económica\n- **Sectores involucrados:** Actividades artísticas, recreativas y de entretenimiento\n- **Región de impacto:** Castellón / Castelló (ES522)\n- **Estado de convocatoria:** Cerrada\n- **Fechas importantes:**\n    - Inicio solicitudes: 16/12/2024\n    - Fin solicitudes: 20/12/2024\n- **Documentos relevantes:**\n    1. **Bases reguladoras:** [Bases reguladoras](https://burriana.sedelectronica.es/board/975b37c8-f59b-11de-b600-00237da12c6a/)\n    2. **Anuncio bases reguladoras:** [Anuncio bases reguladoras](https://www.pap.hacienda.gob.es/bdnstrans/GE/es/convocatoria/803034/document/1176763)",
        "retrieved_contexts": [
            "Convocatoria: \nDetalle de la convocatoria de ayuda o  subvención: 803034\nEnlace a convocatoria: https://www.pap.hacienda.gob.es/bdnstrans/GE/es/convocatorias/803034\nÓrgano, comunidad, autonomía, provincia o ayuntamiento convocante: BORRIANA/BURRIANA - AYUNTAMIENTO DE BORRIANA/BURRIANA\nEnlace / url a sede electrónica presentación ayuda: \nFecha de recepción: 2024-12-13T15:19:31+01:00\nTipo de ayuda: SUBVENCIÓN Y ENTREGA DINERARIA SIN CONTRAPRESTACIÓN \nTipo de convocatoria: Concurrencia competitiva - canónica\nPresupuesto total: 1200 Euros\nDescripción: Concurso de belenes ciudad de Burriana 2024\nTipos de beneficiarios: PERSONAS FÍSICAS QUE NO DESARROLLAN ACTIVIDAD ECONÓMICA\nSectores involucrados: ACTIVIDADES ARTÍSTICAS, RECREATIVAS Y DE ENTRETENIMIENTO\nRegión de impacto: ES522 - Castellón / Castelló\nFinalidad: Cultura\nBases reguladoras: Bases reguladoras de la convocatoria del concurso de belenes ciudad de Burriana 2024\nURL Bases Reguladoras: https://burriana.sedelectronica.es/board/975b37c8-f59b-11de-b600-00237da12c6a/\nPublicación en diario oficial: Sí\nEstado de convocatoria abierta: No\nFecha de inicio de solicitudes: 2024-12-16T00:00:00+01:00\nFecha de fin de solicitudes: 2024-12-20T00:00:00+01:00\nInicio de convocatoria: \nFin de convocatoria: \nReglamento: \nOtros documentos de la convocatoria: \nDescripción: Documento de la convocatoria en español, Nombre: Anuncio bases reguladoras de la convocatoria del concurso de belenes 2024.pdf, Enlace: https://www.pap.hacienda.gob.es/bdnstrans/GE/es/convocatoria/803034/document/1176763 \n\nConvocatoria: \nDetalle de la convocatoria de ayuda o  subvención: 802723\nEnlace a convocatoria: https://www.pap.hacienda.gob.es/bdnstrans/GE/es/convocatorias/802723\nÓrgano, comunidad, autonomía, provincia o ayuntamiento convocante: SANTA MARÍA DE CAYÓN - AYUNTAMIENTO DE SANTA MARÍA DE CAYÓN\nEnlace / url a sede electrónica presentación ayuda: https://sedesantamariadecayon.simplificacloud.com/\nFecha de recepción: 2024-12-13T00:16:22+01:00\nTipo de ayuda: SUBVENCIÓN Y ENTREGA DINERARIA SIN CONTRAPRESTACIÓN \nTipo de convocatoria: Concurrencia competitiva - canónica\nPresupuesto total: 70000 Euros\nDescripción: “BASES Y CONVOCATORIA PARA LA CONCESIÓN DE AYUDAS AL ESTUDIO EN EL MUNICIPIO DE SANTA MARÍA DE CAYÓN PARA EL CURSO ESCOLAR 2024-2025”\nTipos de beneficiarios: PERSONAS FÍSICAS QUE NO DESARROLLAN ACTIVIDAD ECONÓMICA\nSectores involucrados: EDUCACIÓN\nRegión de impacto: ES130 - Cantabria\nFinalidad: Educación\nBases reguladoras: BASES Y CONVOCATORIA PARA LA CONCESIÓN DE AYUDAS AL ESTUDIO EN EL MUNICIPIO DE SANTA MARÍA DE CAYÓN PARA EL CURSO ESCOLAR 2024-2025\nURL Bases Reguladoras: https://www.santamariadecayon.es/\nPublicación en diario oficial: Sí\nEstado de convocatoria abierta: No\nFecha de inicio de solicitudes: 2024-12-16T00:00:00+01:00\nFecha de fin de solicitudes: 2025-01-17T00:00:00+01:00\nInicio de convocatoria: \nFin de convocatoria: \nReglamento: \nOtros documentos de la convocatoria: \n\nConvocatoria: \nDetalle de la convocatoria de ayuda o  subvención: 803035\nEnlace a convocatoria: https://www.pap.hacienda.gob.es/bdnstrans/GE/es/convocatorias/803035\nÓrgano, comunidad, autonomía, provincia o ayuntamiento convocante: CANARIAS - CONSEJERÍA DE ECONOMÍA, INDUSTRIA, COMERCIO Y AUTÓNOMOS\nEnlace / url a sede electrónica presentación ayuda: https://sede.gobiernodecanarias.org/sede\nFecha de recepción: 2024-12-13T15:21:23+01:00\nTipo de ayuda: SUBVENCIÓN Y ENTREGA DINERARIA SIN CONTRAPRESTACIÓN \nTipo de convocatoria: Concurrencia competitiva - canónica\nPresupuesto total: 662377.15 Euros\nDescripción: CONVOCATORIA BECAS PRÁCTICAS PROGRAMA BECAS EN NEGOCIOS INTERNACIONALES 2024-2025\nTipos de beneficiarios: PERSONAS FÍSICAS QUE NO DESARROLLAN ACTIVIDAD ECONÓMICA\nSectores involucrados: EDUCACIÓN\nRegión de impacto: ES70 - CANARIAS\nFinalidad: Educación\nBases reguladoras: PROGRAMA DE BECAS EN NEGOCIOS INTERNACIONALES\nURL Bases Reguladoras: https://www.gobiernodecanarias.org/boc/2024/035/001.html\nPublicación en diario oficial: Sí\nEstado de convocatoria abierta: Sí\nFecha de inicio de solicitudes: \nFecha de fin de solicitudes: \nInicio de convocatoria: A partir del día siguiente al de la publicación del extracto de la convocatoria en el BOC\nFin de convocatoria: Diez (10) días naturales contados desde la fecha de inicio del plazo de presentación de solicitudes\nReglamento: \nOtros documentos de la convocatoria: \nDescripción: Texto en castellano de la convocatoria, Nombre: Documento convocatoria castellano.PDF, Enlace: https://www.pap.hacienda.gob.es/bdnstrans/GE/es/convocatoria/803035/document/1176765 \n\nConvocatoria: \nDetalle de la convocatoria de ayuda o  subvención: 802675\nEnlace a convocatoria: https://www.pap.hacienda.gob.es/bdnstrans/GE/es/convocatorias/802675\nÓrgano, comunidad, autonomía, provincia o ayuntamiento convocante: PAIPORTA - AYUNTAMIENTO DE PAIPORTA\nEnlace / url a sede electrónica presentación ayuda: \nFecha de recepción: 2024-12-12T15:32:22+01:00\nTipo de ayuda: SUBVENCIÓN Y ENTREGA DINERARIA SIN CONTRAPRESTACIÓN \nTipo de convocatoria: Concesión directa - canónica\nPresupuesto total: 5300000 Euros\nDescripción: AYUDAS FUNDACION AMANCIO ORTEGA - DANA\nTipos de beneficiarios: PERSONAS FÍSICAS QUE NO DESARROLLAN ACTIVIDAD ECONÓMICA\nSectores involucrados: ACTIVIDADES SANITARIAS Y DE SERVICIOS SOCIALES\nRegión de impacto: ES523 - Valencia / València\nFinalidad: Otras Prestaciones económicas\nBases reguladoras: PRESUPUESTO MUNICIPAL DEL AYUNTAMIENTO DE PAIPORTA AÑO 2024\nURL Bases Reguladoras: https://bop.dival.es/bop/downloads?anuncioNumReg=2024/02806&lang=va\nPublicación en diario oficial: Sí\nEstado de convocatoria abierta: No\nFecha de inicio de solicitudes: 2024-01-01T00:00:00+01:00\nFecha de fin de solicitudes: \nInicio de convocatoria: Dia siguiente a la publicación de el BOP\nFin de convocatoria: un mes desde el dia siguiente de la publicación en el BOP\nReglamento: \nOtros documentos de la convocatoria: \nDescripción: Texto en castellano de la convocatoria, Nombre: Resolucion_N_3206_de_12122024_DECRETO_ALCALDIA_BASES_REGULADORAS_AYUDAS_FUNDACION_AMANCIO_ORTEGA_GAO.pdf, Enlace: https://www.pap.hacienda.gob.es/bdnstrans/GE/es/convocatoria/802675/document/1175893 \n\nConvocatoria: \nDetalle de la convocatoria de ayuda o  subvención: 802670\nEnlace a convocatoria: https://www.pap.hacienda.gob.es/bdnstrans/GE/es/convocatorias/802670\nÓrgano, comunidad, autonomía, provincia o ayuntamiento convocante: ALGEMESÍ - AYUNTAMIENTO DE ALGEMESÍ\nEnlace / url a sede electrónica presentación ayuda: \nFecha de recepción: 2024-12-12T15:10:34+01:00\nTipo de ayuda: SUBVENCIÓN Y ENTREGA DINERARIA SIN CONTRAPRESTACIÓN \nTipo de convocatoria: Concurrencia competitiva - canónica\nPresupuesto total: 5400000 Euros\nDescripción: AYUDAS FUNDACIÓN AMANCIO ORTEGA\nTipos de beneficiarios: PERSONAS FÍSICAS QUE NO DESARROLLAN ACTIVIDAD ECONÓMICA, PERSONAS JURÍDICAS QUE NO DESARROLLAN ACTIVIDAD ECONÓMICA\nSectores involucrados: Otras actividades de servicios sociales sin alojamiento\nRegión de impacto: ES523 - Valencia / València\nFinalidad: Servicios Sociales y Promoción Social\nBases reguladoras: ORDENANZA GENERAL DE SUBVENCIONES DEL AYUNTAMIENTO DE ALGEMESI\nURL Bases Reguladoras: https://bop.dival.es/bop/downloads?anuncioNumReg=2021/17539&lang=va\nPublicación en diario oficial: Sí\nEstado de convocatoria abierta: No\nFecha de inicio de solicitudes: 2024-12-16T00:00:00+01:00\nFecha de fin de solicitudes: 2025-01-31T00:00:00+01:00\nInicio de convocatoria: \nFin de convocatoria: \nReglamento: \nOtros documentos de la convocatoria: \nDescripción: Texto en castellano de la convocatoria, Nombre: AJUDA VEHICLES.pdf, Enlace: https://www.pap.hacienda.gob.es/bdnstrans/GE/es/convocatoria/802670/document/1175874 \n\n"
        ]
    }
]